userId,text,treatment,num_useful_char,num_useful_words,useful_words
54da182eac97195d12ff5b72,多拉伸慢慢就习惯了，Keep里面搜一搜就有课程的,RI-LE-F,17.0,7.0,多拉伸 习惯 Keep 里面 搜一搜 有 课程 
54f417f03419916320da0213,仅限于查？你有没有自己试过？,RI-HE-M,7.0,4.0,限于 查 有没有 试 
54f5c2e59d3fad607286a183,的确，不过肌肉的酸痛感正好是重训后身体的回应，坚持重训的话，只会有轻微的酸痛感了而且很快就会消失。,RI-HE-F,28.0,15.0,肌肉 酸痛感 是 重训 后 身体 回应 坚持 重训 会 有 轻微 酸痛感 就会 消失 
54f99c447a157b0c0929c36b,应该拉伸,RI-HE-M,4.0,2.0,应该 拉伸 
54fa1246a1079e05609e76d5,拉伸可以很好的舒缓放松肌肉，并不能缓解酸痛哦,RI-LE-F,16.0,8.0,拉伸 可以 很好 舒缓 放松 肌肉 不能 缓解 
55012a8c58c76bef153c0182,？ 这个得看你的训练重量和你的训练强度 你要是运动新手直接来个10kg的哑铃进行手臂训练 怎么拉伸都没有用的,RI-HE-M,28.0,16.0,得 看 训练 重量 训练 强度 运动 新手 来 哑铃 进行 手臂 训练 拉伸 没有 用 
5502aa1d008d964f2a60f0f8,能,RI-LE-M,1.0,1.0,能 
5503f17a460826a735406df4,跑前运动前动态拉伸，运动后静态拉伸已有大量科学证明对缓解肌肉酸痛有帮助，但是缓解程度受运动强度，拉伸时长等很多因素影响，此外，肌肉酸痛的缓解需要一定的时间。,CU-HE-M,62.0,35.0,跑 前 运动 前 动态 拉伸 运动 后 静态 拉伸 已有 大量 科学 证明 缓解 肌肉 有 帮助 缓解 程度 受 运动 强度 拉伸 时 长 很多 因素 影响 肌肉 酸痛 缓解 需要 一定 时间 
5506c982d104a6c9311cd7a1,这看你练啥运动，怎么练～^_^ 运动后拉伸 会减少一点，但也不完全,VI-HE-M,15.0,10.0,看 练 运动 练 运动 后 拉伸 会 减少 完全 
55084830ce50fbcc291b1556,你觉得能就能 拉伸就是放松 别神话他,RI-LE-M,13.0,7.0,觉得 能 就能 拉伸 就是 放松 神话 
55164b03af66a2890cfd6aeb,适当的有氧运动可以快速减少乳酸堆积现象，能让酸痛加速消失,RI-HE-F,22.0,11.0,适当 有氧运动 可以 减少 乳酸 堆积 现象 能 让 加速 消失 
551b5d8eed487d8f2b616e7b,是有效果的，比不拉要好些,VI-LE-M,9.0,6.0,是 有效果 比 拉 要 好些 
55227469ffd3f3a33ea3c471,泡沫轴,RI-HE-M,3.0,2.0,泡沫 轴 
552a6b48449950341283cd35,拉伸舒展肌肉还是可以的，酸还是酸,VI-LE-M,10.0,6.0,拉伸 舒展 肌肉 可以 酸 酸 
552e49103d5f5a753c1f3c85,嗯嗯，其实有道理,VI-HE-F,5.0,3.0,嗯嗯 有 道理 
5536710544909aba3c2f4b71,拉伸有效果,CU-HE-M,5.0,2.0,拉伸 有效果 
5539148da499278b64595bf2,"运动前热身是为了激活能量  保护身体的各关节不会在运动中受伤
运动后的拉伸是放松运动后的神经还有肌肉 拉伸后的线条也会比不拉伸的更漂亮  
前后的放松都很重要也各有作用 我运动后会跟keep拉伸也会自己压腿压韧带 弄些手臂 脖子等拉伸
",CU-HE-F,83.0,47.0,"运动 前 热身 是 激活 能量    保护身体 关节 不会 运动 中 受伤 
运动 后 拉伸 是 放松 运动 后 神经 还有 肌肉 拉伸 后 线条 会 拉伸 前后 放松 很重要 有 作用 运动 后 会 keep 拉伸 会 压腿 压 韧带 弄 手臂 脖子 拉伸 
 "
553b93c0ea1433b9162361b8,有效果，只是不可能拉了就不痛,RI-LE-F,9.0,4.0,有效果 不可能 拉 不痛 
553e3a0447ebb67719e06618,有效啊,CU-LE-M,2.0,1.0,有效 
55406909a499278b645c6d46,所以呢然后呢与我何干,CU-LE-M,2.0,1.0,何干 
5541b452b3f3cdf576ff2b2c,"你好，才看到。
运动前拉伸和运动后拉伸是有效果的也是必要的。运动前的拉伸主要是打开身体，运动后的拉伸确实可以缓解疼痛。如果你运动后拉伸了，依然无法解决疼痛，应该就是你强度太大了，建议你可以多拉伸几分钟。多看看keep的拉伸动作。 学历与热爱运动和生活无关",CU-LE-M,86.0,46.0,"你好 看到 
 运动 前 拉伸 运动 后 拉伸 是 有效果 也是 必要 运动 前 拉伸 是 打开 身体 运动 后 拉伸 可以 缓解 运动 后 拉伸 无法 解决 应该 就是 强度 大 建议 你可以 多拉 伸 看看 keep 拉伸 动作 学历 热爱 运动 生活 无关 "
5542d0fb87850133259cf738,我建议你现在 比较合适 跟着keep的拉伸课程去进行拉伸 比如上肢 下肢 全身拉伸,RI-LE-M,32.0,15.0,我建议 现在 合适 跟着 keep 拉伸 课程 去 进行 拉伸 比如 上肢 下肢 全身 拉伸 
5544e299ee35f51629118e8f,运动后拉伸 按压 是可以缓解的,CU-HE-M,12.0,7.0,运动 后 拉伸 按压 是 可以 缓解 
5548cb34c77eed4f1f1ee5bd,能稍微缓解一点点 用泡沫轴滚一滚放松更有效,CU-HE-F,13.0,8.0,能 缓解 泡沫 轴 滚 滚 放松 更有效 
554903d6c77eed4f1f1f2fc2,你好！这方面专业的东西我也不是很懂，不过我自己感觉运动前后的拉伸，特别是运动后，至少可以减轻肌肉酸痛的程度,RI-HE-M,33.0,18.0,你好 方面 专业 东西 不是 懂 感觉 运动 前后 拉伸 是 运动 后 可以 减轻 肌肉 酸痛 程度 
55496ec4ac499c733ed4a27a,坚持就有效,CU-LE-M,4.0,2.0,坚持 有效 
554f5aba5cf1aade61e2d113,用泡沫轴，规律的按摩，会缓解,CU-LE-M,10.0,6.0,泡沫 轴 规律 按摩 会 缓解 
5550ac0b4ab2eef12deea8b5,你好。建议可以买按摩仪进行按摩，放松肌肉。另外要关注下，因为姿势不对、受力肌肉不对也会导致酸疼，要注意动作标准,CU-HE-M,41.0,21.0,你好 建议 可以 买 按摩仪 进行 按摩 放松 肌肉 要 关注 姿势 不对 受力 肌肉 不对 会导致 要 注意 动作 标准 
55516363dbba0b2b7e404778,拉伸到位是可以减少酸痛的,RI-HE-F,9.0,5.0,拉伸 到位 是 可以 减少 
55534e11db6a9a3825f87468,有效的哦，训练完毕后的拉伸，可以减少第二天的肌肉酸痛感，尤其是练腿后，拉伸和不拉伸，第二天的感觉是天堂和地狱的感觉……,RI-HE-F,35.0,20.0,有效 训练 完毕 后 拉伸 可以 减少 肌肉 酸痛感 是 练 腿 后 拉伸 拉伸 感觉 是 天堂 地狱 感觉 
5553680cba89689b54a73d3c,？,RI-HE-M,0.0,0.0,
5553e982035706f4548d752d,拉伸不是为了减轻酸痛的吧，是把肌肉纤维拉长我理解,RI-LE-F,17.0,8.0,拉伸 不是 减轻 酸痛 是 肌肉纤维 拉长 理解 
5555db43fefc4c05a94cb7fc,我个人认为，拉伸的目的是为了运动起来不会受伤，肌肉的酸痛跟运动量和身体状况有关，想要减少肌肉酸痛减轻，后期的拉伸和按摩必不可少，让身体逐渐适应运动量就好。,RI-HE-M,56.0,27.0,个人 认为 拉伸 目的 是 运动 起来 不会 受伤 肌肉 运动量 身体 状况 有关 想要 减少 肌肉 减轻 后期 拉伸 按摩 必不可少 让 身体 适应 运动量 就好 
5557603b0604b9443453e595,不好意思现在才看到,RI-HE-F,8.0,3.0,不好意思 现在 看到 
55577f9131f57af6f6a49e20,运动前后拉伸主要是放松用的 拉伸完自己舒服 缓解肌肉紧张 肌肉酸痛这东西有点复杂,VI-LE-F,30.0,16.0,运动 前后 拉伸 是 放松 用 拉伸 完 舒服 缓解 肌肉 紧张 肌肉 酸痛 这东西 复杂 
55584d09350d2415804cc481,肌肉酸痛是因为运动完乳酸堆积，是正常的～继续运动和多吃蛋白质有助于加速乳酸代谢 拉伸也很重要的,VI-HE-F,39.0,19.0,肌肉 酸痛 是因为 运动 完 乳酸 堆积 是 正常 继续 运动 吃 蛋白质 有助于 加速 乳酸 代谢 拉伸 很重要 
555d31de5e92f1cfe04b3910,"您好 缓解肌肉酸痛只是拉伸的一个方面 并不是说只要拉伸了第二天就不会酸痛，肌肉酸痛和你当天的运动量，肌纤维产生了多大规模的撕裂有关，在进行大强度的运动之后，肌肉酸痛是非常正常的现象 如果想要缓解后面几天的肌肉酸痛可以做到：
1、运动完5-10分钟之内进行对应部位的拉伸
2、摄入碳水、蛋白质、足够的水、膳食纤维等营养
3、保证充足的睡眠
4、进行符合自身水平的强度训练（有一定基础之后可以进行略微超出一些自己能力的训练和多样化的复合训练，这样有助于提高身体能力）
5、制定有规律的训练计划并严格执行",RI-HE-M,167.0,85.0,"您好 缓解 肌肉 拉伸 方面 不是 说 拉伸 不会 酸痛 肌肉 酸痛 当天 运动量 肌纤维 产生 多大规模 撕裂 有关 进行 大 强度 运动 之后 肌肉 酸痛 正常 现象 想要 缓解 后面 肌肉 酸痛 可以 做到 
 运动 完 之内 进行 对应 部位 拉伸 
2 摄入 碳 水 蛋白质 足够 水 膳食纤维 营养 
 保证 充足 睡眠 
 进行 符合 水平 强度 训练 有 一定 基础 之后 可以 进行 超出 能力 训练 多样化 复合 训练 有助于 提高 身体 能力 
 制定 有 规律 训练 计划 执行 "
555ed6dee1c49041704321eb,运动前充分热身   运动后拉伸按摩对肌肉酸痛肯定有好处,RI-HE-F,19.0,11.0,运动 前 热身    运动 后 拉伸 按摩 肌肉 酸痛 有 好处 
555f4fa31ba0f4343455db0a,我看也只能对我自己做评论，捂脸,RI-HE-F,8.0,6.0,看 只能 做 评论 捂 脸 
556152774a498458cf6baf9c,有效 至少不会堆积成块 对于我这种一天至少健身2小时以上的人,RI-HE-M,15.0,8.0,有效 不会 堆积 成块 健身 小时 以上 人 
55634440d1c44b5fcb3a4e3a,？啊我觉得还好？有点用？,CU-HE-M,5.0,3.0,觉得 还好 用 
5565d39a7936469be5c576a6,你好，运动的学问还是挺多的，其实酸疼不算疼，这都是会经历的，还是希望运动像学习一下，慢慢来，一直在路上,RI-HE-F,27.0,14.0,你好 运动 学问 多 酸疼 都是 会 经历 希望 运动 像 学习 慢慢来 在路上 
55680b6491d790cc25987d5a,肌肉酸痛会随时间慢慢减少，合理休息也可以。,VI-HE-F,13.0,7.0,肌肉 酸痛 会 时间 减少 休息 可以 
556857efe85b26a6eef41f4e,我觉得还可以呀,CU-LE-F,4.0,2.0,觉得 可以 
557104aca0b3f1a21c547484,我都是安排瑜伽拉伸泡沫轴狼牙棒筋膜枪,RI-HE-M,17.0,9.0,都是 安排 瑜伽 拉伸 泡沫 轴狼 牙棒 筋膜 枪 
55716ef55065f50f9b19c11f,个人观点哈，拉伸本身也是一种运动方法，运动后可以降低肌肉兴奋，运动前的动态拉伸可以作为初始的激活。按运动方法来讲都是要适当啦。本身也是主要训练前后的辅助训练。,RI-LE-F,59.0,31.0,个人 观点 拉伸 也是 运动 方法 运动 后 可以 降低 肌肉 兴奋 运动 前 动态 拉伸 可以 作为 初始 激活 运动 方法 来讲 都是 要 适当 也是 训练 前后 辅助 训练 
5571bf0fbda2040108eb599a,锻炼太少啦，形成肌肉记忆就好了 一般一个星期左右就不会疼了,RI-HE-F,18.0,10.0,锻炼 少 形成 肌肉 记忆 就好 星期 左右 不会 疼 
557246fbc0eab78198a0f136,有效，继续做,VI-LE-M,5.0,3.0,有效 继续 做 
55729c2b1e69c6415c69c765,个人见解：运动前的拉伸，更多的是防止伤害吧 运动后的放松，我觉得是有效的，至少乳酸那些不容易堆积在肌肉里,RI-HE-F,33.0,19.0,个人 见解 运动 前 拉伸 更多 是 防止 伤害 运动 后 放松 觉得 是 有效 乳酸 堆积 肌肉 里 
5575a76734e0542a49511910,你好你好最近没怎么上 运动前可以选择慢跑/小重量抗阻训练热身减少肌肉拉伤的风险，同时可以选择咖啡这些也能缓解酸痛感；运动后的肌肉，韧带处于紧绷充血状态，这时候可以通过筋膜枪泡沫轴这些放松肌肉，并补充足量蛋白质以及注意休息来缓解肌肉疲劳，至于拉伸能否确确实实缓解酸痛众说纷纭，但它能让肌肉形态更加好看 我看到有说法是如果经常运动就要拉伸，如果很久不运动突然运动尽量不拉伸，避免充血的肌肉组织被撕裂 我的话是拉伸的同时辅以按摩已经蛋白质补充这些,RI-HE-F,144.0,77.0,最近 没 上 运动 前 可以 选择 慢跑 小 重量 抗阻 训练 热身 减少 肌肉 拉伤 风险 可以 选择 咖啡 能 缓解 酸痛感 运动 后 肌肉 韧带 处于 紧绷 充血 状态 这时候 可以 筋膜 枪 泡沫 轴 放松 肌肉 补充 足量 蛋白质 注意 休息 来 缓解 肌肉 拉伸 能否 缓解 能 让 肌肉 形态 好看 看到 有 说法 是 运动 就要 拉伸 运动 运动 拉伸 避免 充血 肌肉 组织 撕裂 是 拉伸 同时 辅以 按摩 蛋白质 补充 
55777b4233c943f50d72b2cc,泡澡或者泡脚泡到小腿位置 更容易缓解酸痛 拉伸要分，是否松解了肌肉 如果拉伸没有达到松解的目的，那么还是会 另一个，肌肉对于乳酸的代谢能力也是一个影响因素 综合下来，要运动者本人去体会，什么程度的拉伸，或者什么类型的松解活动，个体更适应 我更喜欢泡澡 我老公更喜欢筋膜枪 我婆婆喜欢瑜伽拉伸 公公喜欢瑜伽球拉伸 我总结的经验就是，如果拉伸最终的结果没有帮助肌肉松解，乳酸快读代谢，那么就还是做功消耗，对缓解酸痛没有什么作用 所以，搞清楚什么样的运动会产生什么样的肌肉做功，以及需要被拉伸的肌肉位置，以及拉伸动作是否是前面的解，这样就知道如何有效拉伸了 希望对你有帮助 运动前 、后的拉伸目的并不同，前是为了让觉知进入状态，以及调动起肌肉和气息，所做的拉伸； 后是为了平复气息，以及肌肉做功后产生的乳酸等等，而做的拉伸；从力学和气上，两个相反的发展方向 up 和 pace,RI-HE-F,240.0,129.0,泡澡 泡脚 泡 到 小腿 位置 缓解 拉伸 要 分 解 肌肉 拉伸 没有 达到 松解 目的 会 肌肉 乳酸 代谢 能力 也是 影响因素 综合 下来 要 运动者 去 体会 程度 拉伸 类型 松解 活动 个体 适应 更喜欢 泡澡 老公 更喜欢 筋膜 枪 婆婆 喜欢 瑜伽 拉伸 公公 喜欢 瑜伽 球 拉伸 总结 经验 就是 拉伸 最终 结果 没有 帮助 肌肉 松解 乳酸 读 代谢 做功 消耗 缓解 没有 作用 搞清楚 什么样 运动会 产生 什么样 肌肉 做功 需要 拉伸 肌肉 位置 拉伸 动作 是 前面 解 知道 拉伸 希望 有 帮助 运动 前 后 拉伸 目的 不同 前 是 让 觉 知 进入 状态 调动 起 肌肉 气息 做 拉伸 后 是 平复 气息 肌肉 做功 后 产生 乳酸 做 拉伸 力学 气 上 相反 发展 方向 up pace 
5577e9ba81248ed65d025718,说没有用，你得自己尝试，感觉到底有没有用。,RI-LE-F,10.0,7.0,说 没有 用 得 尝试 感觉 用 
55783edebc0cae352188798f,"有用！！！！
可有效减少运动损伤！",RI-LE-M,10.0,5.0,"有用 
 可 减少 运动损伤 "
55791684d5bc592bd549c898,"我也不是太懂啊！说得不对，仅供参考！
一般来说，肌肉锻炼后拉伸锻炼部位，可以减轻后面的酸痛，但注意的是，拉伸要在锻炼后半小时内完成！而且，只是减轻，不能完全消除！
还有，就是大重量的肌肉锻炼，可以通过一下练前拉伸，减少肌肉筋膜粘滞，但一般对练后的缓解酸痛没作用！",RI-LE-F,83.0,47.0,"不是 懂 说 不对 仅供参考 
 一般来说 肌肉 锻炼 后 拉伸 锻炼 部位 可以 减轻 后面 注意 是 拉伸 要 锻炼 后 内 完成 减轻 不能 消除 
 还有 就是 大 重量 肌肉 锻炼 可以 练 前 拉伸 减少 肌肉 筋膜 粘滞 练 后 缓解 没 作用 "
557a5b6bfe2f2632c99f4c81,大肌群运动后休息两三天 比如背和臀腿 或者换不酸痛的部位练 肌肉是在不断撕裂中成长 如果这个训练部位酸痛超过五天 就是训练强度大了  运动前激活 运动后拉伸必不可少 泡沫轴放松滚滚也可以缓解,RI-HE-M,65.0,36.0,大肌群 运动 后 休息 比如 背 臀腿 换 酸痛 部位 练 肌肉 是 撕裂 中 成长 训练 部位 酸痛 超过 就是 训练 强度 大   运动 前 激活 运动 后 拉伸 必不可少 泡沫 轴 放松 可以 缓解 
5580dbc9d4af1b85bc12ee1d,应该是能的吧,CU-HE-M,4.0,3.0,应该 是 能 
5583dc8e864ea780be0e31bb,我觉得能,CU-HE-M,3.0,2.0,觉得 能 
5583edf90a562b43c047776a,运动前后拉伸主要是防止受伤和肌肉紧张得到舒缓,VI-HE-F,17.0,9.0,运动 前后 拉伸 是 防止 受伤 肌肉 紧张 得到 
5585b6bdd03f46508a335561,凡事没有绝对，只有相对,RI-HE-F,8.0,4.0,凡事 没有 绝对 相对 
5586460f87f60ccb656a3b61,怎么说吧，不要一下子运动量太大就好,RI-HE-F,9.0,5.0,说 不要 运动量 大 就好 
5586c50b19ae59d7bd6fca0a,我理解的是，一般刚运动完并不会立刻酸痛，拉伸按摩更多是缓解肌肉僵硬和胀痛。如果当下就有痛感那可能更多是运动姿势不对，对肌肉关节等等造成了损伤？如果第二天有酸痛感，好像可以用快走或者慢跑的方式排酸？,CU-LE-M,62.0,33.0,理解 是 运动 完 不会 酸痛 拉伸 按摩 是 缓解 肌肉 僵硬 胀痛 当下 有痛感 可能 是 运动 姿势 不对 肌肉 关节 造成 损伤 第二天 有 酸痛感 可以 快走 慢跑 方式 排 酸 
55897bf5d04777697c01cb5b,你就跟着keep上的教程做就行啦，一般每节课里都有拉伸环节的,RI-HE-M,18.0,11.0,跟着 keep 上 教程 做 行 课 里 有 拉伸 环节 
558e4ea2fdecbb8cd7bedce6,我一般运动后做拉伸，感觉还挺有用的，如果你刚开始运动做的强度比较大或者时间比较长，那估计这一周都会全身酸酸的，长期坚持锻炼会好很多，拉伸的时候拉伸到位是会很酸爽但是拉伸过后会觉得超级舒服,RI-HE-F,60.0,35.0,运动 后 做 拉伸 感觉 有用 开始 运动 做 强度 大 时间 长 估计 都会 全身 酸酸 长期 坚持 锻炼 会 好 很多 拉伸 时候 拉伸 到位 是 会 酸爽 拉伸 过后 会 觉得 舒服 
55914507d58f212f077d0490,我觉得跑前过度拉伸反而影响发挥 适度舒展身体后 运动后拉伸比较好,RI-LE-F,23.0,13.0,觉得 跑 前 拉伸 影响 发挥 舒展 身体 后 运动 后 拉伸 比较好 
55914e180fda796808bc7bae,肯定有,VI-LE-M,1.0,1.0,有 
5591564586c8ea0c069132d1,你好，我也不太懂，但是一直坚持锻炼完拉伸，不拉伸的话身体就会有僵硬的感觉，拉伸或者瑜伽后就舒服了,CU-HE-M,28.0,16.0,你好 懂 坚持 锻炼 完 拉伸 拉伸 身体 就会 有 僵硬 感觉 拉伸 瑜伽 后 舒服 
55931cd832114dc7a31531dd,您好，我个人认为热身和拉伸总是好的,CU-LE-F,12.0,6.0,您好 个人 认为 热身 拉伸 好的 
55940545104d7c23a5a57282,当然需要呀，运动前热身防止拉伤损伤，运动后拉伸排防止乳酸堆积和筋膜粘接,RI-HE-F,29.0,16.0,需要 运动 前 热身 防止 拉伤 损伤 运动 后 拉伸 排 防止 乳酸 堆积 筋膜 粘接 
5594c41c36e3319d0222f123,"嗯嗯 你好 虽然我不是专业的 但以我的经验来看 要么是太久没有锻炼 肌肉短时间不适应 坚持训练 过段时间会好
 另一种是 选择的强度太高了 拉伸有用 肌肉长时间紧张不拉伸 更容易受伤 再加上按摩 筋膜松解之类的
 其实 还是实践出真知 不要看别人怎么说 你要自己感受自己的身体",CU-HE-F,77.0,42.0,"嗯嗯 不是 专业 经验 来看 是 没有 锻炼 肌肉 短时间 不适应 坚持 训练 过 时间 会 好 
  是 选择 强度 高 拉伸 有用 肌肉 长时间 紧张 拉伸 受伤 再加上 按摩 筋膜 解 
  实践 出 真知 不要看 说 要 感受 身体 "
5596323ace5755621d9d4413,"我没研究过 不清楚 也不是专业人士  
主要是 我从以前就有运动完拉伸的习惯 不拉伸会怎么样 不清楚 抱歉哈 没能解决你的问题",RI-HE-F,35.0,20.0,"没 研究 清楚 不是 专业人士   
 是 以前 有 运动 完 拉伸 习惯 拉伸 会 清楚 抱歉 能 解决 问题 "
559760b0d1f0172519b0b37b,保持正确的拉伸运动  持续坚持 是有效果的,CU-LE-M,16.0,9.0,保持 正确 拉伸 运动    持续 坚持 是 有效果 
5597fae5b242fdf31880ab10,有一点吧，我其实也不怎么拉伸。。。,RI-HE-F,3.0,2.0,有 拉伸 
55981b29ce5755621d9d7e3d,拉伸是很好的排除乳酸的方法，也是避免受伤的方法,CU-LE-M,19.0,10.0,拉伸 是 很好 排除 乳酸 方法 也是 避免 受伤 方法 
5598c7470fb726b41e9d0ac8,什么能不能 可能能可能不能？ 实在没法缓解买个滚轴试试，我一般不酸,CU-HE-M,20.0,10.0,能不能 可能 能 可能不能 没法 缓解 买 滚轴 试试 酸 
55992401016a26061b1f4342,不能 低于40分钟的拉伸都是无效拉伸,RI-HE-F,12.0,6.0,不能 低于 拉伸 都是 无效 拉伸 
559a51f46ca1b84f94c7f812,拉伸一下更有助于恢复体能和状态,VI-LE-M,11.0,5.0,拉伸 有助于 恢复 体能 状态 
559a8db13defbf9e952e80e6,不能 预防受伤,VI-HE-M,6.0,3.0,不能 预防 受伤 
559b25cdac29b6b694a5a9b7,是的，只能缓解一点，但如果经常运动，每周4、5次左右，就不会有肌肉酸痛现象了,CU-HE-F,18.0,10.0,是 只能 缓解 运动 左右 不会 有 肌肉 酸痛 现象 
559cfe40b26ec5581c975246,运动前拉伸可以防止运动损伤，运动后拉伸可以更好的恢复，我觉得挺有用的。,CU-LE-F,28.0,15.0,运动 前 拉伸 可以 防止 运动 损伤 运动 后 拉伸 可以 更好 恢复 觉得 有用 
559e13d863bf889f7c036a6c,没有研究表明拉伸会对训练后延迟性肌肉酸痛有改善效果，但是拉伸会提升肌肉弹性，保持关节的活动度，对预防损伤和改善体态有特别大的帮助,VI-HE-F,52.0,28.0,没有 研究 表明 拉伸 会 训练 后 延迟性 肌肉 酸痛 有 改善 效果 拉伸 会 提升 肌肉 弹性 保持 关节 活动度 预防 损伤 改善 体态 有 大 帮助 
559e9081808318b41ba75a4f,确实不能 延迟性酸痛的机制目前还没有研究明白，有时候拉伸充分了反而更疼,RI-HE-F,20.0,10.0,不能 延迟性 酸痛 机制 目前 研究 明白 拉伸 充分 疼 
55a3c38ce9a1d4232157618f,还是要拉伸一下,RI-LE-F,3.0,2.0,要 拉伸 
55a516abd914da8e354dcdbd,我觉得运动前稍微热身下 运动后的拉伸也必要 为了放松肌肉 肌肉酸痛可能刚开始运动 都会这样 特别是隔天更酸  实在酸那用筋膜枪 个人觉得自己拉伸酸爽 拉完会放松,CU-HE-F,52.0,32.0,觉得 运动 前 热身 下 运动 后 拉伸 必要 放松 肌肉 肌肉 酸痛 可能 开始 运动 都会 是 隔天 酸    酸 筋膜 枪 个人 觉得 拉伸 酸爽 拉 完 会 放松 
55a7c3cc3429cbe54b8850d6,😁美女在哪里搜的说拉伸没用哈？ 哦，美女说的是肌肉酸痛要放松呀 确实普通的拉伸对肌肉放松效果确实要若很多，所以用筋膜枪效果会更好一些,RI-HE-F,41.0,25.0,😁 美女 搜 说 拉伸 没用 美女 说 是 肌肉 酸痛 要 放松 普通 拉伸 肌肉 放松 效果 要 很多 筋膜 枪 效果 会 更好 
