userId,text,treatment,num_useful_char,num_useful_words,useful_words
58dbd2fd49330374ffa368b4,拉伸一下，第二天没那么酸 我运动都有热身和拉伸的，偶尔还用泡沫轴滚一下,CU-HE-F,15.0,10.0,拉伸 没 酸 运动 有 热身 拉伸 泡沫 轴 滚 
58dce78e387e280a0c2edcbe,运动前充分热身，微微出汗，运动后再做拉伸,RI-LE-F,13.0,8.0,运动 前 热身 出汗 运动 后 做 拉伸 
58de7b55387e282ef24009f9,酸痛感，好像就是一开始锻炼的时候会有。因为身体机能不太适应。后面经常锻炼就不会啦 只不过拉伸，就是为了不受伤,RI-HE-M,29.0,14.0,酸痛感 锻炼 时候 会 有 身体 机能 适应 后面 锻炼 不会 拉伸 就是为了 受伤 
58e08bb14933035eb8f78397,能吧,RI-HE-M,1.0,1.0,能 
58e3591e31f116662a71b0bf,你多泡keep这些软件，慢慢就知道了 说实话我也不太懂 但是，运动前后拉伸还是非常有必要和帮助的，我个人而言 可以看下动作是否标准 我挺喜欢拉伸的，很舒服,RI-HE-M,39.0,19.0,泡 keep 软件 知道 说实话 懂 运动 前后 拉伸 帮助 个人 可以 看 动作 是否 标准 喜欢 拉伸 很舒服 
58e4fef2387e2810faef46e2,运动前后拉伸我觉得是一个缓冲区 加油,RI-LE-M,14.0,7.0,运动 前后 拉伸 觉得 是 缓冲区 加油 
58e5fced387e28025d65ff4f,得看你做什么类型的运动，无论是有氧还是无氧，第一次会出现疼痛，如果是上器械，同样的重量一周会适应，为减疼痛可以拉伸后按摩运动部位,RI-LE-F,38.0,23.0,得 看 做 类型 运动 是 有氧 无氧 会出现 是 上 器械 同样 重量 会 适应 减 可以 拉伸 后 按摩 运动 部位 
58e7261231f116051a4677bc,我没有那么专业，但非常迷信的坚持运动前热身，运动后拉伸,RI-HE-M,18.0,10.0,没有 专业 迷信 坚持 运动 前 热身 运动 后 拉伸 
58e74aeb4933037e1ca9c160,都可以 你自己觉得怎么舒服怎么来,CU-HE-F,7.0,4.0,可以 觉得 舒服 来 
58e77dd731f116051a4940a5,能 多少能减轻些 但……运动后注意补水 蛋白质摄入量 休息 足够的睡眠有助于你第二天减轻肌肉酸痛 肌肉是有记忆的 长时间如果不运动 刚开始那几天酸痛会明显些   习惯几天后就不会那么酸痛了 坚持✊加油 慢慢你就习惯了 先苦后甜 如果疼痛都忍不了 那你就不要运动了……,RI-HE-F,70.0,38.0,能 能 减轻 运动 后 注意 补水 蛋白质 摄入量 休息 足够 睡眠 有助于 减轻 肌肉 酸痛 肌肉 是 有 记忆 长时间 运动 开始 会 明显     习惯 后 不会 酸痛 坚持 ✊ 加油 习惯 苦后甜 忍 不要 运动 
58e79508387e28025d735363,你好 我觉得还可 我跑步跑前跑后拉伸下蛮好的。,RI-HE-M,16.0,11.0,你好 觉得 可 跑步 跑 前 跑 后 拉伸 下 蛮好 
58e7b5e64933037e1caf137b,你好,RI-HE-F,2.0,1.0,你好 
58e89eeb8c26a36298a572a7,其实我觉得还是有用哒 因为不拉伸会很痛哈哈哈哈哈哈 拉伸至少能缓解不少,RI-LE-F,15.0,9.0,觉得 有用 拉伸 会 痛 拉伸 能 缓解 不少 
58e8d8ed4933037e1cb64d58,有效 自己选择就可以,RI-LE-M,6.0,3.0,有效 选择 可以 
58e958c631f116051a57e6f5,我一般运动后拉伸 效果好些,RI-LE-M,9.0,5.0,运动 后 拉伸 效果 好些 
58e9ce58387e28025d84318a,能啊…,RI-LE-F,1.0,1.0,能 
58e9fb76387e28025d861f30,有效,RI-HE-F,2.0,1.0,有效 
58ea0c25387e28025d86de11,拉伸只是放松肌肉 很久不做运动 你突然运动 即使拉伸很久还是第二天会酸痛╯﹏╰,RI-LE-M,22.0,11.0,拉伸 放松 肌肉 不做 运动 运动 拉伸 很久 第二天 会 酸痛 
58ea36c9387e28025d89a979,我感觉拉伸还是比不拉伸好的 也可以试一下大型拉伸，踩腿那种,CU-HE-F,16.0,10.0,感觉 拉伸 拉伸 好 可以 试 大型 拉伸 踩 腿 
58eae6e8387e28025d8dbc4b,当然有效 但是不止是拉伸 练完需要放松肌肉呀 拉伸是远远不够的 必须用泡沫轴放松 放松肌肉筋膜，缓解肌肉疲劳，​提高肌肉灵活性，不僵硬紧绷。,CU-HE-F,45.0,25.0,有效 是 拉伸 练 完 需要 放松 肌肉 拉伸 是 不够 泡沫 轴 放松 放松 肌肉 筋膜 缓解 肌肉 ​ 提高 肌肉 灵活性 僵硬 紧绷 
58ec8eac387e282664387160,有啊,RI-HE-M,1.0,1.0,有 
58ecf1f68c26a302563608d8,还是有一定效果的,RI-HE-F,5.0,3.0,有 一定 效果 
58eee62331f1162dc79da590,可以的,CU-LE-M,2.0,1.0,可以 
58ef536931f1162dc7a0bcbb,这应该跟个人体质和训练强度有关吧，你要是训练强度很大，就是如来佛祖来给你指导，该疼还得疼，拉伸只是为了预防避免受伤，起到辅助作用,VI-LE-F,45.0,26.0,应该 个人 体质 训练 强度 有关 训练 强度 很大 就是 如来 佛祖 来 指导 该 疼 得 疼 拉伸 预防 避免 受伤 起 到 辅助 作用 
58f07f39387e282664606f75,"我觉得会有效，因为不拉伸确实会更加酸痛
感谢你关注我(*°∀°)=3",RI-HE-M,16.0,10.0,"觉得 会 有效 拉伸 会 酸痛 
 关注 ∀ =3 "
58f0832d4933032c2a4d78d7,不知道你搜了什么？如何得此结论…我从来没有停过没效的说法…也更不会否定之前热身，以后拉伸的必须…,RI-LE-F,26.0,13.0,不知道 搜 得 结论 从来没有 停 没效 说法 不会 否定 热身 以后 拉伸 
58f0ab6031f1162dc7ac1d2c,能的,RI-LE-F,1.0,1.0,能 
58f0d004387e282664643cc0,😂😂一开始确实容易酸疼，跑步久了后就还好啦！跑前跑后拉伸最好！,RI-HE-F,18.0,12.0,😂😂 酸疼 跑步 久 后 还好 跑 前 跑 后 拉伸 最好 
58f220d4387e2826646eaa6e,那是动作不到位,CU-HE-F,6.0,3.0,是 动作 不到位 
58f30b51387e282664759cf1,可以适当按摩按摩 揉一揉个人感觉有用,RI-LE-F,13.0,6.0,可以 按摩 按摩 揉一揉 个人 感觉 
58f3619131f1162dc7c35c9e,一样的，酸痛很正常。连着练个几天就啥事儿没有了。不能停。加油,RI-LE-M,18.0,9.0,一样 酸痛 很正常 练 事儿 没有了 不能 停 加油 
58f43524387e2826647f07c4,我觉得拉伸很有效的,CU-HE-M,6.0,3.0,觉得 拉伸 有效 
58f469a431f1162dc7ca25f6,我也不知道啊,RI-HE-F,3.0,1.0,不知道 
58f6ed9a31f1162861bbf6d4,运动后拉伸只是缓解肌肉疲劳，使身体更有型，经常坚持锻炼酸胀感就会慢慢减轻,RI-LE-M,26.0,13.0,运动 后 拉伸 缓解 肌肉 使 身体 更有型 坚持 锻炼 酸胀感 就会 减轻 
58f780cc387e281bd1283b29,🤥,CU-HE-F,1.0,1.0,🤥 
58f84cc6387e281bd12cf98a,需要泡沫轴或筋膜枪会好点,CU-HE-F,10.0,7.0,需要 泡沫 轴 筋膜 枪 会 好 
58f852af387e281bd12d44a8,我也不是专业运动的，不过我运动完，拉伸加按摩还挺有效的,RI-HE-F,14.0,8.0,不是 运动 运动 完 拉伸 加 按摩 有效 
58f8a3ee31f1162861cbe08e,你好呀，我觉得这个是可以减少的呢，是不是你锻炼的强度太大，拉伸的幅度太小，导致这个情况的呢？ 自我感觉，锻炼之后的拉伸完全可以避免第二天的肌肉酸疼，希望对你有帮助呀,CU-LE-M,45.0,24.0,觉得 是 可以 减少 是不是 锻炼 强度 大 拉伸 幅度 小 导致 情况 感觉 锻炼 之后 拉伸 可以 避免 肌肉 酸疼 希望 有 帮助 
58f96e978c26a3632ad06534,只要拉伸做的够充分，一定有用 拉伸时间大于运动时间，酸痛第二天坚持运动，很快缓解的,CU-LE-F,23.0,12.0,拉伸 做 充分 有用 拉伸 时间 大于 运动 时间 坚持 运动 缓解 
58fa9584387e281bd14115f2,拉伸运动对运动后肌肉恢复有帮助特别是长期运动不拉伸的话肌肉会变得死板,RI-LE-F,28.0,16.0,拉伸 运动 运动 后 肌肉 恢复 有 帮助 是 长期 运动 拉伸 肌肉 会 变得 死板 
58fb071949330323c3d37118,没有效果 多用按摩轴吧 不正确的拉伸反而会伤筋 酸痛多按摩,RI-HE-F,18.0,10.0,没有 效果 用 按摩 轴 不正确 拉伸 会 伤筋 按摩 
58fb36b58c26a3632ae0b954,无效,RI-HE-M,2.0,1.0,无效 
58fb851d387e281bd14cca09,运动前，准确地说，热身就好。运动后，如果是跑步等有氧运动，还是要拉伸的，酸痛没体验过，但可以明显缓解肌肉僵硬。个人感觉，不代表全部。,RI-LE-F,41.0,22.0,运动 前 地说 热身 就好 运动 后 是 跑步 有氧运动 要 拉伸 没 体验 可以 缓解 肌肉 僵硬 个人 感觉 代表 全部 
58fdf5bd387e281bd15f55c6,你好 有点效果,RI-LE-F,6.0,3.0,你好 有点 效果 
58fe04d549330323c3ee266c,肯定有效果，不能减少是因为拉伸不到位,RI-HE-F,15.0,6.0,有效果 不能 减少 是因为 拉伸 不到位 
590091c731f11628610b490b,没用就别做呀,RI-LE-M,3.0,2.0,没用 做 
5900c40f49330323c30147ab,运动后的拉伸是可以缓解。,VI-HE-M,10.0,6.0,运动 后 拉伸 是 可以 缓解 
5901ab2531f11606e5479593,有效果,RI-LE-F,3.0,1.0,有效果 
5901b829387e2875ca3ab1c5,那你就自学,CU-LE-M,2.0,1.0,自学 
5903142a31f1162eb1181c8f,能 运动后的拉伸，能够让第2天的酸痛感更轻，我感觉,RI-HE-F,15.0,9.0,能 运动 后 拉伸 能够 让 酸痛感 轻 感觉 
59052805387e281e7a641e25,不好意思，刚看keep 运动前拉伸放松主要是为了提高运动状态，减少运动损伤。 运动后拉伸主要是为了放松肌肉紧张程度，让肌肉更具张力 肌肉酸痛主要是乳酸堆积，以及肌肉撕裂再生长导致的，所以对于酸痛部位多拉伸放松是有用的，不过需要一个过程，就像感冒了吃感冒药也不可能立刻好,CU-LE-F,94.0,48.0,不好意思 看 keep 运动 前 拉伸 放松 是 提高 运动 状态 减少 运动 损伤 运动 后 拉伸 是 放松 肌肉 紧张 程度 让 肌肉 更具 张力 肌肉 酸痛 是 乳酸 堆积 肌肉 撕裂 长 导致 酸痛 部位 多拉伸放松 是 有用 需要 过程 就像 感冒 吃 感冒药 不可能 好 
5905e6124933037c0a38524e,运动后，是酸爽，不是酸痛……😄😄,RI-LE-F,8.0,5.0,运动 后 是 不是 😄😄 
5907bb5d4933037c0a426b23,"可以减轻肌肉酸疼， 运动前动态热身活动身体
运动后静态拉伸  减少乳酸积累，加快身体恢复，减轻身体酸痛 可能你没经历过大量训练，运动量大了拉伸完会很舒服，不拉后面几天很疼（延迟性肌肉酸痛） 加油",RI-HE-F,76.0,42.0,"可以 减轻 肌肉 酸疼 运动 前 动态 热身 活动 身体 
 运动 后 静态 拉伸    减少 乳酸 积累 加快 身体 恢复 减轻 身体 可能 没 经历 大量 训练 运动量 大 拉伸 完 会 很舒服 拉 后面 疼 延迟性 肌肉 酸痛 加油 "
5907f640387e281e7a74eb93,运动后身上酸痛很正常，一般拉伸过后也要一两天后酸痛才会好转,VI-LE-M,23.0,11.0,运动 后 身上 酸痛 很正常 拉伸 过后 要 一两天后 才会 好转 
59082d798c26a32b327eb7f6,你好 其实我也不太懂 不知道你练的是那一方面 如果大重量训练后的肌肉酸痛是正常的呀,CU-LE-F,24.0,14.0,你好 懂 不知道 练 是 一方面 大 重量 训练 后 肌肉 酸痛 是 正常 
590894e48c26a32b32822816,那你可以用泡沫轴滚一滚哦,CU-LE-F,8.0,5.0,你可以 泡沫 轴 滚 滚 
590adf4a31f11631d3d9c2a7,我也不是很懂这种理论性的东西 但是我觉得拉伸主要是缓解运动以后紧张的肌肉的，要是要缓解肌肉酸痛你可以按摩按摩,CU-HE-M,37.0,19.0,不是 懂 理论性 东西 觉得 拉伸 是 缓解 运动 以后 紧张 肌肉 要 缓解 肌肉 酸痛 你可以 按摩 按摩 
590ae271387e28241ef0fc71,运动后拉伸可以有效缓解,CU-HE-F,9.0,5.0,运动 后 拉伸 可以 缓解 
590aed784933037bb15bf5dd,我也不是专业人士，😂,RI-LE-F,7.0,3.0,不是 专业人士 😂 
590c2cff8c26a328f05f0f80,虽不能起到立竿见影的效果，但还是非常有必要的 运动肌肉充血肿胀一段时间，适当的拉伸会缓解肌肉紧绷的状态，使肌肉线条更加自然流畅,RI-HE-M,44.0,22.0,不能 起 到 立竿见影 效果 运动 肌肉 充血 肿胀 一段时间 适当 拉伸 会 缓解 肌肉 紧绷 状态 使 肌肉 线条 自然 流畅 
590c49a04933037bb164e3a2,不会呀 很有效果呀 可以使用泡沫轴,RI-HE-M,12.0,6.0,不会 有效果 可以 使用 泡沫 轴 
590d2b118c26a328f0689afb,有作用呀，可能动作不标准是没拉伸到位,RI-LE-F,15.0,9.0,有 作用 可能 动作 标准 是 没 拉伸 到位 
590f3c198c26a328f081c44d,我也不太清楚，只是按照自己的身体状况，选适合自己的运动,CU-HE-M,11.0,6.0,清楚 身体 状况 选 适合 运动 
591002894933037bb18c753c,必要的拉伸还是需要的吧。不过我觉得好好休息也很有用😀,RI-HE-F,14.0,7.0,必要 拉伸 需要 觉得 休息 很有用 😀 
5910ae6b8c26a328f08ffc62,其实不能，拉不拉伸区别不大…只是运动后身体发热好拉开而已,CU-LE-F,19.0,11.0,不能 拉 拉伸 区别 不大 运动 后 身体 发热 好 拉开 
5910f27b8c26a328f0917eb1,运动前拉伸下还是有必要的，降低受伤几率，运动后拉伸可以让肌肉更快的恢复,RI-HE-F,28.0,16.0,运动 前 拉伸 下 有必要 降低 受伤 几率 运动 后 拉伸 可以 让 肌肉 快 恢复 
59121807387e28241e3b6879,肌肉酸痛主要是运动后乳酸堆积。拉伸对它的改善作用应该不大，但可以减少肌肉粘连，有助于肌肉恢复、生长，下回运动就不会那么容易酸痛了,CU-HE-M,43.0,22.0,肌肉 是 运动 后 乳酸 堆积 拉伸 改善 作用 应该 不大 可以 减少 肌肉 粘连 有助于 肌肉 恢复 生长 运动 不会 酸痛 
59132e1f8c26a328f0b18b63,有效啊。,CU-LE-F,2.0,1.0,有效 
59145d2a4933034e5769f98f,运动前拉伸主要是不让你在运动时受伤，，运动后拉伸是让肌肉不囤积，保持更优美线条,RI-HE-F,29.0,18.0,运动 前 拉伸 是 让 运动 时 受伤 运动 后 拉伸 是 让 肌肉 囤积 保持 优美 线条 
591484348c26a35717283228,可以在健身之前补充肌酸哈，加油！,RI-HE-M,10.0,5.0,可以 健身 补充 肌酸 加油 
59167ada8c26a357173e9cf1,我觉得是可以的 拉伸一下对身体肌肉缓解有好处的,RI-LE-M,16.0,9.0,觉得 是 可以 拉伸 身体 肌肉 缓解 有 好处 
5916b72e31f11668f370aeca,可以用泡沫轴,CU-LE-F,5.0,3.0,可以 泡沫 轴 
59171ca28c26a357174abddd,运动前是热身，运动后才是拉伸,CU-HE-F,13.0,8.0,运动 前 是 热身 运动 后 才是 拉伸 
59181f0b31f11668f384df90,能,RI-HE-M,1.0,1.0,能 
5918715c8c26a357175e89ab,我也不是专业健身的，运动前热身，运动后拉伸可以缓解酸痛。如果肌肉酸痛明显，说明你的运动量大了，尤其是当你刚开始运动的时候，运动完肌肉酸痛的情况很常见。坚持运动 循序渐进，同时还要有必要的休息恢复。原则上肌肉只要还酸痛 就暂停训练。 建议你读一下 施瓦辛格健身全书,RI-LE-M,85.0,41.0,不是 健身 运动 前 热身 运动 后 拉伸 可以 缓解 肌肉 酸痛 明显 说明 运动量 大 是 当你 开始 运动 时候 运动 完 肌肉 酸痛 情况 常见 坚持 运动 循序渐进 还要 休息 恢复 肌肉 酸痛 暂停 训练 建议 读一下 施瓦辛格 健身全书 
591a2ce44933034b5e026bd7,"慢慢动起来，不需要着急，运动前热身和拉伸有必要
另外，请自信起来，你很棒已经开始优秀了",RI-LE-F,24.0,13.0,"动起来 不需要 着急 运动 前 热身 拉伸 
 请 自信 起来 棒 开始 "
591a8420387e281d31fc9fde,疼习惯了就不疼了 我有时候运动会睡在床上身上都是疼的 习惯了，就不疼了。身体承受能力就强了。 比如我做腹肌撕裂，会疼个一个星期，但是后面就没感觉了。 慢慢增加运动，你会发现可以变的更强,RI-LE-F,48.0,28.0,疼 习惯 疼 运动会 睡 身上 都是 疼 习惯 疼 身体 承受能力 强 做 腹肌 撕裂 会 疼 星期 后面 没感觉 增加 运动 会 发现 可以 变 强 
591adcb1387e281d3100e5c2,我觉得有效。,RI-HE-F,2.0,1.0,觉得 
591ae5004933034b5e0ae71a,运动前拉伸时避免受伤 运动后拉伸是恢复肌肉的弹性，让肌肉的线条更加好看。 肌肉的酸痛是乳酸堆积 拉伸肯定会有一定的效果，但是乳酸堆积是正常的。 要在自己能承受的运动量内运动，乳酸堆积就不会太严重。,VI-HE-F,69.0,40.0,运动 前 拉伸 时 避免 受伤 运动 后 拉伸 是 恢复 肌肉 弹性 让 肌肉 线条 好看 肌肉 是 乳酸 堆积 拉伸 会 有 一定 效果 乳酸 堆积 是 正常 要 能 承受 运动量 内 运动 乳酸 堆积 不会 严重 
591b0067387e281d3103daf1,"有点 主要是拉伸的时间要合适和方式
",RI-HE-M,11.0,7.0,"是 拉伸 时间 要 合适 方式 
 "
591d7da44933034b5e2a26e5,运动前热身 运动后拉伸 但不能缓解肌肉酸痛的 热身是为了防止运动受伤 拉伸是为了放松肌肉 希望能帮到你,RI-LE-F,39.0,23.0,运动 前 热身 运动 后 拉伸 不能 缓解 肌肉 酸痛 热身 是 防止 运动 受伤 拉伸 是 放松 肌肉 希望 能 帮 到 
591e421d387e281d312a7cd5,运动前动态热身，运动后静态拉伸😎,CU-LE-M,15.0,9.0,运动 前 动态 热身 运动 后 静态 拉伸 😎 
592017678c26a36ff4cc1097,运动前是热身防止拉伤 运动后是舒缓 我觉得有用,CU-LE-M,16.0,10.0,运动 前 是 热身 防止 拉伤 运动 后 是 觉得 
5920329189f2d116ae6bee27,这个因人而异，同时运动多久，也看体质。,CU-HE-M,7.0,4.0,而异 运动 看 体质 
592142cb4933034b5e5245c0,我觉得有效果,RI-LE-F,5.0,2.0,觉得 有效果 
592149b7387e281d314936e4,我不知道欸,RI-HE-M,3.0,1.0,不知道 
59228c3d8c26a36ff4e48587,多练练就不疼了,CU-HE-M,3.0,2.0,练练 疼 
5923a49631f116063d152200,习惯就好,RI-HE-M,4.0,2.0,习惯 就好 
592524ff89f2d116ae99f184,有啊,CU-LE-F,1.0,1.0,有 
59259a0e8c26a36ff401c34a,你好，谢谢关注 运动前要热身运动，是可以刺激肌肉参与运动的同时身体减少受伤 运动后的拉伸是放松在运动中一直处于紧张的肌肉，你要缓解肌肉酸痛最好是按摩肌肉，泡沫轴和筋膜枪是最好的选择 运动愉快！希望能帮助到你😃,RI-HE-M,85.0,48.0,你好 谢谢 关注 运动 前 要 热身 运动 是 可以 刺激 肌肉 参与 运动 同时 身体 减少 受伤 运动 后 拉伸 是 放松 运动 中 处于 紧张 肌肉 要 缓解 肌肉 最好是 按摩 肌肉 泡沫 轴 筋膜 枪 是 最好的 选择 运动 愉快 希望 能 帮助 到 😃 
5928088a4933030da76ede32,恩德,RI-LE-M,2.0,1.0,恩德 
5928092989f2d12fb468da86,筋膜枪试试,RI-HE-M,5.0,3.0,筋膜 枪 试试 
59291ba631f11667c94b25dd,运动前的拉伸是提高身体的柔韧性，柔韧性会影响动作的质量，至于运动后的拉伸可以减轻酸痛感，但避免不了酸痛感。健身和学历关系不大，用心都可以做到更好,CU-LE-M,52.0,26.0,运动 前 拉伸 是 提高 身体 柔韧性 柔韧性 会 影响 动作 质量 运动 后 拉伸 可以 减轻 酸痛感 避免 酸痛感 健身 学历 关系 不大 可以 做到 
592a940b493303625d6fe8cc,运动前热身，运动后拉伸 运动循序渐进,RI-LE-M,16.0,8.0,运动 前 热身 运动 后 拉伸 运动 循序渐进 
592aa13a89f2d1595ef46f66,我觉得运动前拉伸可以避免损伤  如果有基础的话运动后的到没那么重要,CU-HE-F,25.0,14.0,觉得 运动 前 拉伸 可以 避免 损伤    有 基础 运动 后 到没 那么重要 
592ab036493303625d711d7a,你好，按拉伸动作做到位是可以减缓肌肉酸痛的。如果你不是经常运动，运动量可以少一些，等身体适应后再上强度。这样会好一些,RI-LE-F,39.0,21.0,你好 拉伸 动作 做到位 是 可以 减缓 肌肉 酸痛 不是 运动 运动量 可以 少 等 身体 适应 后 上 强度 会好 
592b74178c26a34c25482a74,有效啊 实践经验,RI-LE-F,6.0,3.0,有效 实践 经验 
592c119931f11610700b7277,运动后肌肉酸痛是正常现象，如果你平时很少运动，酸痛会比较明显，一般两三天就会消除。运动前后拉伸是一定要的，会让肌肉线条更好看，拉伸后可以用泡沫轴按摩，也可以缓解酸痛。另外运动量要循序渐进，根据自己的身体情况而定，运动动作要标准，强度慢慢增加。,CU-LE-F,81.0,44.0,运动 后 肌肉 酸痛 是 正常 现象 平时 运动 会 明显 就会 消除 运动 前后 拉伸 是 一定要 会 让 肌肉 线条 更好看 拉伸 后 可以 泡沫 轴 按摩 可以 缓解 外运 动量 要 循序渐进 身体 情况 定 运动 动作 要 标准 强度 增加 
592d7305493303625d8504e3,酸痛没得啥子缓解 酸痛只能酸痛,RI-LE-F,10.0,5.0,没得 啥子 缓解 只能 酸痛 
592fe78f493303625d98f073,啊？ 不可能,CU-LE-F,3.0,1.0,不可能 
592ff34331f1161070289e8e,？,CU-HE-F,0.0,0.0,
5930f2a0493303625da249a3,拉伸不能减少酸痛的😂可以有效防止肌肉因紧张而聚集后的肌肉形态不好,RI-HE-F,24.0,13.0,拉伸 不能 减少 酸痛 😂 可以 防止 肌肉 聚集 后 肌肉 形态 不好 
5930fc6289f2d1595e269a19,啥意思,RI-LE-F,2.0,1.0,意思 
5931492531f1161070347d21,个人感觉，肌肉酸痛是由于肌肉比较紧，没有放松下来，拉伸可以让肌肉的韧性更好，好像拉面一样，很筋道，😄,CU-LE-F,38.0,21.0,个人 感觉 肌肉 酸痛 是 肌肉 紧 没有 放松 下来 拉伸 可以 让 肌肉 韧性 更好 好像 拉面 一样 筋道 😄 
5931fbc231f11610703ad6e2,这个主要的作用还是防止受伤 肌肉疼痛是必然的，除非强度不够,CU-HE-M,19.0,10.0,主要 作用 防止 受伤 肌肉 疼痛 是 必然 强度 不够 
5932be5c89f2d1595e375eef,多少会让你舒服一点的，拉伸到位了的话,CU-LE-M,8.0,5.0,会 让 舒服 拉伸 到位 
59339d068c26a34c258b4e62,拉伸对于缓解肌肉酸痛肯定有用，筋膜枪也可以。,RI-HE-F,13.0,7.0,拉伸 缓解 肌肉 有用 筋膜 枪 可以 
5934025c89f2d1595e436e7d,其实运动前的充分拉伸是保护你在运动过程中会受伤，运动后拉伸是放松肌肉，有缓解肌肉酸痛的效果 但如果你是久不运动，突然运动过量，肌肉酸痛是必然的，这个需要三四天让乳酸分解后就好了，在这个过程中，你可以按摩揉捏酸痛的地方，加速一下这个过程,CU-HE-M,80.0,46.0,运动 前 充分 拉伸 是 保护 运动 过程 中 会 受伤 运动 后 拉伸 是 放松 肌肉 有 缓解 肌肉 酸痛 效果 是 久 运动 运动 过量 肌肉 酸痛 是 必然 需要 让 乳酸 分解 后 就好 过程 中 你可以 按摩 揉捏 酸痛 地方 加速 过程 
59349429387e287caa510eb4,不好意思哈，设置信息不提醒，现在才看到你的消息 这方面不是很留意，不过还是要拉伸一下放松肌肉 我刚开始跑步的时候也不怎么拉伸，听那些跑步大牛说还是要拉伸，所以也这一两年才开始跑前热身跑后拉伸的,RI-LE-F,56.0,31.0,不好意思 设置 信息 提醒 现在 看到 消息 方面 不是 留意 要 拉伸 放松 肌肉 开始 跑步 时候 拉伸 听 跑步 大牛 说 要 拉伸 开始 跑 前 热身 跑 后 拉伸 
5935363c493303784ed5ad6c,我认为运动前拉伸就是运动热身，防止你身体一下子没适应带来扭伤。运动后拉伸可以帮助放松一下紧张的肌肉，还是有一定作用的,CU-LE-M,43.0,23.0,认为 运动 前 拉伸 就是 运动 热身 防止 身体 适应 带来 扭伤 运动 后 拉伸 可以 帮助 放松 紧张 肌肉 有 一定 作用 
593651d5493303784ee1b882,运动后拉伸有必要 而且需要进行按摩肌肉放松 用泡沫轴滚轴等,VI-HE-M,20.0,10.0,运动 后 拉伸 需要 进行 按摩 肌肉 放松 泡沫 轴滚轴 
59367bbd387e283cd47ad8eb,如果拉伸没有缓解肌肉酸痛，可以尝试一下按摩轴，keep上面有按摩轴课程。 进阶的话可以尝试筋膜枪,RI-LE-M,38.0,20.0,拉伸 没有 缓解 肌肉 酸痛 可以 尝试 按摩 轴 keep 上面 有 按摩 轴 课程 进阶 可以 尝试 筋膜 枪 
5937702d8c26a3088aa61731,没做到位,CU-HE-F,3.0,1.0,做到位 
5937ca1d31f116222f93a880,拉伸是不能减少酸痛，只是让加运动的肌肉得到放松而已,RI-LE-M,17.0,10.0,拉伸 是 不能 减少 让 加 运动 肌肉 得到 放松 
5938dd5c387e283cd493716b,很有效的 运动前热身，运动后拉伸可以有效缓解肌肉疲劳,VI-LE-F,20.0,10.0,有效 运动 前 热身 运动 后 拉伸 可以 缓解 肌肉疲劳 
593a95ff31f116222fb06fac,略微有效,VI-HE-M,2.0,1.0,有效 
593aa6078c26a3088ac77f1f,健身不分你什么学历,RI-HE-F,6.0,3.0,健身 不分 学历 
593bd2228c26a3088ad2d291,用泡沫轴,CU-HE-F,3.0,2.0,泡沫 轴 
593c9ee931f116222fc529a9,效果不明显，按摩一下泡个热水澡睡一觉效果不错的,RI-HE-F,18.0,8.0,效果 不明显 按摩 泡 热水澡 睡一觉 效果 不错 
593cb60689f2d118186bbd6e,你觉得不能就不能咯,CU-HE-M,6.0,3.0,觉得 不能 不能 
593f5abd387e282f7e45707d,我一般是跑步后，或者燃脂30分钟以上会拉伸,CU-LE-F,11.0,7.0,是 跑步 后 燃脂 以上 会 拉伸 
593fbdec2881d70d1d590533,我觉得有效的 跑前拉伸算是热身 也能避免受伤 跑后拉伸和拍打 能够缓解肌肉酸痛,CU-LE-F,31.0,18.0,觉得 有效 跑 前 拉伸 算是 热身 能 避免 受伤 跑 后 拉伸 拍打 能够 缓解 肌肉 酸痛 
5940ae862881d70d1d5a835c,你好呀 不好意思哈，我没看到有私信 没有，运动后拉伸对肌肉酸痛是有效的 所以运动后都要及时拉伸哈 然后，运动前也是要适当热身的，减少运动中受伤的可能性,RI-LE-M,48.0,27.0,不好意思 没 看到 有 私信 没有 运动 后 拉伸 肌肉 酸痛 是 有效 运动 后 要 拉伸 运动 前 也是 要 热身 减少 运动 中 受伤 可能性 
594108b62881d70d1d5b19ac,运动前热身是为了防止运动的时候受伤，运动后拉伸当然有一定程度可以缓解肌肉酸痛，也能防止小腿变粗,VI-HE-F,39.0,23.0,运动 前 热身 是 防止 运动 时候 受伤 运动 后 拉伸 有 一定 程度 可以 缓解 肌肉 酸痛 能 防止 小腿 变 粗 
